{
  "name": "runtime-truth",
  "version": "0.1.3",
  "mode": "audit-only",
  "evidenceContract": "../../contracts/evidence-pack/evidence-pack.schema.json",
  "commandPolicy": "../command-policies/runtime-truth.json",
  "adapterSchema": "../../schemas/project-adapter.schema.json",
  "adapterCompatibility": {
    "contractVersion": "1.0.0",
    "compatibleAdapterVersions": ["1.0.0"]
  },
  "adapterInterface": "../../skills/runtime-truth/adapter-interface.md",
  "description": "Correlate process, listener, and unauthenticated health evidence."
}
