{
  "name": "env-audit",
  "version": "0.2.3",
  "mode": "audit-only",
  "evidenceContract": "../../contracts/evidence-pack/evidence-pack.schema.json",
  "commandPolicy": "../command-policies/env-audit.json",
  "adapterSchema": "../../schemas/project-adapter.schema.json",
  "adapterCompatibility": {
    "contractVersion": "1.0.0",
    "compatibleAdapterVersions": ["1.0.0"]
  },
  "adapterInterface": "../../skills/env-audit/adapter-interface.md",
  "description": "Identify environment variable names without reading values."
}
