{
  "name": "route-trace",
  "version": "0.2.3",
  "mode": "audit-only",
  "evidenceContract": "../../contracts/evidence-pack/evidence-pack.schema.json",
  "commandPolicy": "../command-policies/route-trace.json",
  "adapterSchema": "../../schemas/project-adapter.schema.json",
  "adapterCompatibility": {
    "contractVersion": "1.0.0",
    "compatibleAdapterVersions": ["1.0.0"]
  },
  "adapterInterface": "../../skills/route-trace/adapter-interface.md",
  "description": "Trace static route surfaces without executing project code."
}
