{
  "name": "repo-map",
  "version": "0.2.0",
  "mode": "audit-only",
  "evidenceContract": "../../contracts/evidence-pack/evidence-pack.schema.json",
  "commandPolicy": "../command-policies/repo-map.json",
  "adapterSchema": "../../schemas/project-adapter.schema.json",
  "adapterCompatibility": {
    "contractVersion": "1.0.0",
    "compatibleAdapterVersions": ["1.0.0"]
  },
  "adapterInterface": "../../skills/repo-map/adapter-interface.md",
  "description": "Map repository identity and structure without mutation."
}
