{
  "name": "llm-drift-control",
  "version": "0.2.3",
  "mode": "audit-only",
  "evidenceContract": "../../contracts/evidence-pack/evidence-pack.schema.json",
  "commandPolicy": "../command-policies/llm-drift-control.json",
  "adapterSchema": "../../schemas/project-adapter.schema.json",
  "adapterCompatibility": {
    "contractVersion": "1.0.0",
    "compatibleAdapterVersions": ["1.0.0"]
  },
  "adapterInterface": "../../skills/llm-drift-control/adapter-interface.md",
  "description": "Classify project claims against bounded repository evidence."
}
