{
  "name": "deployment-preflight",
  "version": "0.2.3",
  "mode": "audit-only",
  "evidenceContract": "../../contracts/evidence-pack/evidence-pack.schema.json",
  "commandPolicy": "../command-policies/deployment-preflight.json",
  "adapterSchema": "../../schemas/project-adapter.schema.json",
  "adapterCompatibility": {
    "contractVersion": "1.0.0",
    "compatibleAdapterVersions": ["1.0.0"]
  },
  "adapterInterface": "../../skills/deployment-preflight/adapter-interface.md",
  "description": "Map static deployment readiness evidence without deployment behavior."
}
